{"blinded":true,"blindTargetSetSha256":"b1aa24164cc6882aaac8b4660ccc06759cf3be89f137f8f0aa8e0479ca241cc7","contractVersion":"m3-1-blind-packet-v2","custodialMappingRequired":true,"deliveryContract":{"annotationBundleOnly":true,"repositoryAccessPermitted":false,"sourceManifestAccessPermitted":false,"splitAccessPermitted":false},"executionBlocker":null,"humanExecutable":true,"orderContract":{"algorithm":"sha256-seed-nul-target-id-v1","independentReconstructionRequired":true,"orderedBlindTargetIdsSha256":"b1aa24164cc6882aaac8b4660ccc06759cf3be89f137f8f0aa8e0479ca241cc7","orderSeedSha256":"7b535936a22b331973216210de2fc0e031e7700a3bfe73363f7cd99e622cd396"},"packetId":"blind_packet_m3_1_public_pilot_v2","packetSha256":"077ac6c849a649f3a73f4379accea4aac9d161e0d25184c12b770a4311b8a276","targetCount":192,"targets":[{"blindTargetId":"blind_target_031b09fde32aaa28967719836af22f20","context":{"artifactPath":"blind-context/context_7083530f61eba23dda41b411.svg","artifactSha256":"7083530f61eba23dda41b411b1ae2495f0f49f8a1618aca0692f011ea8437348","byteLength":46340,"mediaType":"image/svg+xml","renderingContract":{"externalAssetsFetched":false,"independentContentVerificationRequired":true,"limitations":["Font identity and production renderer capture are not frozen; annotation remains process-pilot evidence only."],"mode":"browser-native-isolated-svg","sanitizerContractVersion":"m3-1-svg-blind-sanitizer-v2","sourceByteTreatment":"deterministic-svg-sanitization-v2","sourceScope":"exact-svg-document"},"targetLocator":{"mode":"context-structural-path","structuralPathWithinContext":"/g[0]/text[12]"}},"neutralOrder":1,"ruleId":"svg/text-clipped"},{"blindTargetId":"blind_target_04d0b36a59dd5a35c38e93038b2814ee","context":{"artifactPath":"blind-context/context_af51981490b9d5b983813011.svg","artifactSha256":"af51981490b9d5b983813011733ba98d049f4a204088466a53546db71a618123","byteLength":4345,"mediaType":"image/svg+xml","renderingContract":{"externalAssetsFetched":false,"independentContentVerificationRequired":true,"limitations":["Only the sanitized embedded inline SVG is presented; the containing HTML page is not included.","Font identity and production renderer capture are not frozen; annotation remains process-pilot evidence only."],"mode":"browser-native-isolated-svg","sanitizerContractVersion":"m3-1-svg-blind-sanitizer-v2","sourceByteTreatment":"deterministic-svg-sanitization-v2","sourceScope":"embedded-inline-svg-only"},"targetLocator":{"mode":"context-structural-path","structuralPathWithinContext":"/text[4]"}},"neutralOrder":2,"ruleId":"svg/text-ink-collision"},{"blindTargetId":"blind_target_06c3404863a29a82c251207e9863a2c9","context":{"artifactPath":"blind-context/context_af51981490b9d5b983813011.svg","artifactSha256":"af51981490b9d5b983813011733ba98d049f4a204088466a53546db71a618123","byteLength":4345,"mediaType":"image/svg+xml","renderingContract":{"externalAssetsFetched":false,"independentContentVerificationRequired":true,"limitations":["Only the sanitized embedded inline SVG is presented; the containing HTML page is not included.","Font identity and production renderer capture are not frozen; annotation remains process-pilot evidence only."],"mode":"browser-native-isolated-svg","sanitizerContractVersion":"m3-1-svg-blind-sanitizer-v2","sourceByteTreatment":"deterministic-svg-sanitization-v2","sourceScope":"embedded-inline-svg-only"},"targetLocator":{"mode":"context-structural-path","structuralPathWithinContext":"/text[18]"}},"neutralOrder":3,"ruleId":"svg/text-ink-collision"},{"blindTargetId":"blind_target_06cd6dceb1fe548d60a1f55cc26ffd5f","context":{"artifactPath":"blind-context/context_af51981490b9d5b983813011.svg","artifactSha256":"af51981490b9d5b983813011733ba98d049f4a204088466a53546db71a618123","byteLength":4345,"mediaType":"image/svg+xml","renderingContract":{"externalAssetsFetched":false,"independentContentVerificationRequired":true,"limitations":["Only the sanitized embedded inline SVG is presented; the containing HTML page is not included.","Font identity and production renderer capture are not frozen; annotation remains process-pilot evidence only."],"mode":"browser-native-isolated-svg","sanitizerContractVersion":"m3-1-svg-blind-sanitizer-v2","sourceByteTreatment":"deterministic-svg-sanitization-v2","sourceScope":"embedded-inline-svg-only"},"targetLocator":{"mode":"context-structural-path","structuralPathWithinContext":"/text[20]"}},"neutralOrder":4,"ruleId":"svg/text-overflows-viewport"},{"blindTargetId":"blind_target_07058778ec6ec3c2b1b07ff87db386f0","context":{"artifactPath":"blind-context/context_af51981490b9d5b983813011.svg","artifactSha256":"af51981490b9d5b983813011733ba98d049f4a204088466a53546db71a618123","byteLength":4345,"mediaType":"image/svg+xml","renderingContract":{"externalAssetsFetched":false,"independentContentVerificationRequired":true,"limitations":["Only the sanitized embedded inline SVG is presented; the containing HTML page is not included.","Font identity and production renderer capture are not frozen; annotation remains process-pilot evidence only."],"mode":"browser-native-isolated-svg","sanitizerContractVersion":"m3-1-svg-blind-sanitizer-v2","sourceByteTreatment":"deterministic-svg-sanitization-v2","sourceScope":"embedded-inline-svg-only"},"targetLocator":{"mode":"context-structural-path","structuralPathWithinContext":"/text[13]"}},"neutralOrder":5,"ruleId":"svg/text-ink-collision"},{"blindTargetId":"blind_target_07ff67448041d46c3169d09cb96a4508","context":{"artifactPath":"blind-context/context_d296e12750839b71bc1039f4.svg","artifactSha256":"d296e12750839b71bc1039f4830ba6b16a85d59a28120a47349a0b4ee591e67a","byteLength":1887,"mediaType":"image/svg+xml","renderingContract":{"externalAssetsFetched":false,"independentContentVerificationRequired":true,"limitations":["Only the sanitized embedded inline SVG is presented; the containing HTML page is not included.","Font identity and production renderer capture are not frozen; annotation remains process-pilot evidence only."],"mode":"browser-native-isolated-svg","sanitizerContractVersion":"m3-1-svg-blind-sanitizer-v2","sourceByteTreatment":"deterministic-svg-sanitization-v2","sourceScope":"embedded-inline-svg-only"},"targetLocator":{"mode":"context-structural-path","structuralPathWithinContext":"/text[3]"}},"neutralOrder":6,"ruleId":"svg/text-clipped"},{"blindTargetId":"blind_target_097a04c51c3e9aa3dcd541e9accc8904","context":{"artifactPath":"blind-context/context_af51981490b9d5b983813011.svg","artifactSha256":"af51981490b9d5b983813011733ba98d049f4a204088466a53546db71a618123","byteLength":4345,"mediaType":"image/svg+xml","renderingContract":{"externalAssetsFetched":false,"independentContentVerificationRequired":true,"limitations":["Only the sanitized embedded inline SVG is presented; the containing HTML page is not included.","Font identity and production renderer capture are not frozen; annotation remains process-pilot evidence only."],"mode":"browser-native-isolated-svg","sanitizerContractVersion":"m3-1-svg-blind-sanitizer-v2","sourceByteTreatment":"deterministic-svg-sanitization-v2","sourceScope":"embedded-inline-svg-only"},"targetLocator":{"mode":"context-structural-path","structuralPathWithinContext":"/text[20]"}},"neutralOrder":7,"ruleId":"svg/text-clipped"},{"blindTargetId":"blind_target_0a278470e051ec674112e674331ae8a7","context":{"artifactPath":"blind-context/context_aa4eb7a3159b276e806ef0d9.svg","artifactSha256":"aa4eb7a3159b276e806ef0d9b8290e6c22e5b7a8d40ade1a62c07800405076f2","byteLength":61644,"mediaType":"image/svg+xml","renderingContract":{"externalAssetsFetched":false,"independentContentVerificationRequired":true,"limitations":["Font identity and production renderer capture are not frozen; annotation remains process-pilot evidence only."],"mode":"browser-native-isolated-svg","sanitizerContractVersion":"m3-1-svg-blind-sanitizer-v2","sourceByteTreatment":"deterministic-svg-sanitization-v2","sourceScope":"exact-svg-document"},"targetLocator":{"mode":"context-structural-path","structuralPathWithinContext":"/g[0]/text[15]"}},"neutralOrder":8,"ruleId":"svg/text-ink-collision"},{"blindTargetId":"blind_target_0cb8b7d5346f112e90d7a6dff9760b34","context":{"artifactPath":"blind-context/context_aa4eb7a3159b276e806ef0d9.svg","artifactSha256":"aa4eb7a3159b276e806ef0d9b8290e6c22e5b7a8d40ade1a62c07800405076f2","byteLength":61644,"mediaType":"image/svg+xml","renderingContract":{"externalAssetsFetched":false,"independentContentVerificationRequired":true,"limitations":["Font identity and production renderer capture are not frozen; annotation remains process-pilot evidence only."],"mode":"browser-native-isolated-svg","sanitizerContractVersion":"m3-1-svg-blind-sanitizer-v2","sourceByteTreatment":"deterministic-svg-sanitization-v2","sourceScope":"exact-svg-document"},"targetLocator":{"mode":"context-structural-path","structuralPathWithinContext":"/g[0]/text[12]"}},"neutralOrder":9,"ruleId":"svg/text-ink-collision"},{"blindTargetId":"blind_target_0cfa8e3d8ab92c674beb9ed2eb2c8d2a","context":{"artifactPath":"blind-context/context_aa4eb7a3159b276e806ef0d9.svg","artifactSha256":"aa4eb7a3159b276e806ef0d9b8290e6c22e5b7a8d40ade1a62c07800405076f2","byteLength":61644,"mediaType":"image/svg+xml","renderingContract":{"externalAssetsFetched":false,"independentContentVerificationRequired":true,"limitations":["Font identity and production renderer capture are not frozen; annotation remains process-pilot evidence only."],"mode":"browser-native-isolated-svg","sanitizerContractVersion":"m3-1-svg-blind-sanitizer-v2","sourceByteTreatment":"deterministic-svg-sanitization-v2","sourceScope":"exact-svg-document"},"targetLocator":{"mode":"context-structural-path","structuralPathWithinContext":"/g[0]/text[0]"}},"neutralOrder":10,"ruleId":"svg/text-overflows-viewport"},{"blindTargetId":"blind_target_0e50e1e57c526e49f936f4251974e202","context":{"artifactPath":"blind-context/context_aa4eb7a3159b276e806ef0d9.svg","artifactSha256":"aa4eb7a3159b276e806ef0d9b8290e6c22e5b7a8d40ade1a62c0780040